<?xml version="1.0" encoding="utf-8"?>
<MagicTypeDataList
      xmlns:xsd="http://www.w3.org/2001/XMLSchema" 
      xmlns:xsi="http://www.w3.org/2001/XMLSchema-instance"    
      xsi:noNamespaceSchemaLocation="MagicTypes.xsd">

    <!-- todo: add Ritual Descriptions (eg: Righteous Invocations) and color-magic descriptions (eg: Power from on High etc) -->
    <MagicTypeData>
        <Type>I</Type>
        <Color>White</Color>
    </MagicTypeData>
    <MagicTypeData>
        <Type>II</Type>
        <Color>Grey</Color>
    </MagicTypeData>
    <MagicTypeData>
        <Type>III</Type>
        <Color>Gold</Color>
    </MagicTypeData>
    <MagicTypeData>
        <Type>IV</Type>
        <Color>Purple</Color>
    </MagicTypeData>
    <MagicTypeData>
        <Type>V</Type>
        <Color>Black</Color>
    </MagicTypeData>
    <MagicTypeData>
        <Type>VI</Type>
    </MagicTypeData>
    <MagicTypeData>
        <Type>VII</Type>
    </MagicTypeData>
    <MagicTypeData>
        <Type>VIII</Type>
    </MagicTypeData>
</MagicTypeDataList>
